<!ELEMENT IndexSource (ENTREE*) >
<!ELEMENT ENTREE (RELATION+, RENVOIS) >
<!ELEMENT RELATION (LIEN*) >
<!ELEMENT LIEN (#PCDATA) >
<!ELEMENT RENVOIS (LIEN*) >


<!ATTLIST IndexSource corpus CDATA #IMPLIED >
<!ATTLIST ENTREE id			CDATA	#REQUIRED
				 terme		CDATA 	#REQUIRED
				 validite 	CDATA 	#REQUIRED >
<!ATTLIST RELATION	nom		CDATA	#REQUIRED >
